Subgrupo de Causa,2015,2016,2017,2018,2019,2020,2021,2022,2023
J00-J06 INFECCIONES AGUDAS DE LAS VIAS RESPIRATORIAS SUPERIORES,24006,4046347,27081,188233,32354,1720912,2803161,2430865,2766173
J20-J22 OTRAS INFECCIONES AGUDAS DE LAS VIAS RESPIRATORIAS INFERIORES,3379751,4729000,2602657,2527397,3897820,2988773,4397074,3985768,3779720
J30-J39 OTRAS INFECCIONES AGUDAS DE LAS VIAS RESPIRATORIAS SUPERIORES,4873867,3278107,5132475,4160056,4960444,3265981,4912503,5483429,5486865
J40-J47 ENFERMEDADES CRONICAS DE LAS VIAS RESPIRATORIAS INFERIORES,2180416,1790012,2026625,2085215,2440128,2507222,1795209,3200121,2371456
J80-J84 OTRAS ENFERMEDADES RESPIRATORIAS QUE AFECTAN PRINCIPALMENTE AL INTERSTICIO,351000,243000,414000,695000,911000,815000,955000,809000,899000
J85-J86 AFECCIONES SUPURATIVAS Y NECROTICAS DE LAS VIAS RESPIRATORIAS INFERIORES,15000,4000,11000,27000,30000,20000,14000,66000,23000